{"$schema":"https://json-schema.org/draft/2020-12/schema","type":"object","required":["mode","data_mode","budget"],"properties":{"mode":{"const":"host"},"data_mode":{"enum":["synthetic","live"]},"allow_network":{"type":"boolean"},"executor_id":{"type":["string","null"]},"model_id":{"type":["string","null"]},"data_policy":{"type":"object"},"sources":{"type":"object","properties":{"openalex":{"type":"object","properties":{"anonymous":{"type":"boolean"},"api_key_env":{"type":"string","minLength":1},"year_min":{"type":"integer","minimum":1900},"sort":{"enum":["relevance_score:desc","publication_date:desc","cited_by_count:desc"]},"page_size":{"type":"integer","minimum":1,"maximum":100},"max_candidates":{"type":"integer","minimum":1},"max_pages":{"type":"integer","minimum":1},"timeout_seconds":{"type":"integer","minimum":1}},"additionalProperties":false}},"additionalProperties":false},"budget":{"type":"object","minProperties":1,"additionalProperties":{"type":"integer","minimum":1}}},"additionalProperties":true}
